,context_word,genre_code,clip_name,ClipContext_pair,GenreContext_pair,textMIMC_lvl1b
50,videogame,80s,80s_MED_08,VIDEOGAME-80s_MED_08,VID_80s,overly upbeat no real emotions peppy too much endofinput i imagined my self a nostalgic mobile while this as a sound track while i am going through the tutorial endofinput that sounds like the opening theme or closing theme not sure now to some 80s sitcom not gon na specify which you can really just take your pic they all had a very samey sound profile for it endofinput my first thought was it couldve been from a sitcom tv show and then i imagined driving around as wario in mario cart endofinput it had a slight vibe to it endofinput an adventure with hurdles or obstacles to scale although these obstacles may not be too difficult endofinput i saw my lovely son eric acting in their school drama there was this time i watched him act and i was very proud of him the is similar perhaps that is why i immediately imagined the scene endofinput the makes me think of a bustling city at night with all the lights and energy endofinput i imagine driving on an evening the sun is setting and i am enjoying the cool view of nature endofinput it reminds me of that summer night with friends windows down blasting not a care in the world maybe life does not have to be that serious all the time just a cool chilly relaxation endofinput the tune is entertaining endofinput dancing scene in a romance endofinput the sounded more like classic played at family outdoor events endofinput a giant man plodding along the street with a cheery grin on his face greeting everyone as he walks past endofinput a bubbly character strolling through a cute town while hopping on mushrooms endofinput i imagined a group of friends one by one about 8 of them all coming from different directions meeting each other the first being a man just walking on his own down a quiet new york street and he gets happier the more friends come over and they all laugh and talk together whilst walking endofinput this made me imagine i am mario hunting stars and killing mobs because the has this same vibe to it when endofinput an adventure that in the background of the user going around a map or inside and outside of buildings collecting foraging and accumulating items to use in the a sort of fantasy world where items are collected and saved and used later on effectively its a good head bopping which has the right frequencies to be enjoyable but not distracting endofinput it was like i was driving through a busy street in the gta 5 endofinput i imagine a friend group at a beach conversating and having fun with each other endofinput the character arrives at the beach section endofinput a platformer similar to super mario probably older and very colourful endofinput dad dancing bright colours laughing fun endofinput while swede with my friends endofinput like old not for me but i can see the appeal does make you want to dance and feel like you are in the war times at a diner endofinput a car driving towards a sunset at the end of a endofinput i imagined a big with people dancing in front on grass late night endofinput imagined joni mitchell singing a walking down broadway in new york endofinput i pictured an open area world quite colourful and fun lots of free exploration and items to find tucked away in hidden places i imagined this over the open world aspects of the endofinput 
51,videogame,80s,80s_MED_13,VIDEOGAME-80s_MED_13,VID_80s,i thought about a 90s disney it gave me those 90s vibes it reminded me of when i was a kid and when i watch these with my big sister endofinput after i completed the stage any button i press on the controller it makes the sounds i kept hearing endofinput a relaxing beach scene clear blue water very sunny and sandy beaches theres no one there just a very tranquil place endofinput the beginning of the made me think of a final fantasy just going on an adventure but then i got confused when it turned into some kind of rb endofinput even though i can not recall this it gave me great feelings of nostalgia my nintendo 64 when i was younger to me i visualised some type of racing that is set on a beach this is the introduction for the menu screen an it features cool characters that look like they came straight from miami vice or surf culture the cars were sporty and fast endofinput vintage scene from with fairy characters endofinput this most certainly sounds like its from a i imagine it is from the main menu of the where the user can select the mode they want to endofinput the start of a you just click on the initial prompt and now you are at the beginning of the endofinput the sound was really interesting and made me feel good endofinput very 90s clouds ambient greenery there are several vibes i get from this sample many interpretations i thought of those all at different parts endofinput the thoughts of a especially when you are winning or when a is about to start endofinput i imagined a fantasy like labyrinth with mysterious creatures in the scene beautiful scenery and a character going on a journey to discover the mysterious land but also themselves endofinput i imagined more of a nintendo like zelda or something made by them and it be either the title page or near the start of the endofinput i imagine myself and my brother sitting down to a in the evening after school or on the weekend endofinput i imagined a big beautiful river with a lot of magical creatures hanging around and swimming inside the river endofinput it made me think of when i was younger the is soft and floaty endofinput this is probably played after the player has died this is calming with a screen saying continue in bold with a little light flying around maybe to symbolise the players life flying away if it does not agree to continue endofinput this is absolutely title screen of some sort endofinput i see this being used in a 2nd of recent memory then i also picture a from the 1980s very soulful endofinput it made me think of the back in the older times which have you do the most basic tasks it was very peaceful and i want to lay down on grass and chill and think of better things in life endofinput i thought about michael jackson him on the stage spotlights on him the choir is on the side singing alongside with him crowds of fans on the seats waving their hands and cheering the is at the back endofinput this typically reminds me of the old 80s retro so i start thinking about from that generation endofinput i did not have a specific image but i was thinking generically of a and the little clicks in the of something being collected endofinput i imagined a world similar to that in winx club and there were little creatures with wings flying around smiling and laughing with each others the world is colorful and full of candy endofinput it took me back to church choir imagined myself listening to church with congregation endofinput it sounded very familiar only until the voices came in then it stopped sounding familiar at first it sounded like the starting screen for a console when it turns on then when the water drops sort of sound happened it reminded me of a i have heard before i do not know which one but something nostalgic endofinput at first thought it sounded like a sega perhaps racing or sonic endofinput until the vocals came in i though it might be from a nintendo like mario kart but then again maybe the is too calm for that but the vocals confused me a bit endofinput the is heart warming endofinput on my nintendo wii when i was about 6 years old endofinput this sounded like from a kids the introduction of it when its on the home screen endofinput was very calm and relaxing reminded me of a place such as a library or dentist where it is very calming endofinput i imagined this in a when you have reached an ethereal kind of location that you have been waiting to get to for ages i imagined sparkles in the endofinput 
52,videogame,Ele,Ele_LOW_09,VIDEOGAME-Ele_LOW_09,VID_Ele,very charged sounds like a i have heard before in an advert about you not steal a blank feels like its telling you something feels important or like you need to be paying attention endofinput gave much more upbeat energy imagining a car racing through the streets at night with neon lights around or a high speed chase endofinput reminds me of an introduction on gta back when i had an xbox i imagined turning it on and going on gta while waiting for the whole to load and hearing this in the background endofinput dimly lit dance hall bright flashing led lights a dj hyping the people up in the crowd almost a rave air about it endofinput first i imagined a space where you fly around in a space ship and then i imagined watching the aliens in the halo looking out the windows of their spaceship endofinput expect to hear this in an action adventure science fiction endofinput a theme for an adventure endofinput i started trying to remember a lot of action i watched in the past and it made me begin to desire more action i think i watch one tonight endofinput the made me think of driving down a dusty road in the desert at sunset endofinput i imagine its on saturday evening and our favorite show is about to start endofinput i imagine myself fully immersed i a virtual involving combats and adventure endofinput the tune is entertaining endofinput geometry dash thor ragnorok attack on titan nothing came to mind too naturally but that is what it reminded me of endofinput a boss battle with a science fiction tech looking dragon endofinput i imagined a hacker trying his hardest to hack into a company to find out something about one of his friends it gets more and more intense as his screen shows a lot of windows and numbers with him trying his best to figure this code out he finally achieves this endofinput i imagined i was in a battlefield and battle was happening all around me when i was listening to this like the doom endofinput it reminded me heavily of an edm type of drop so for a i was envisioning things like halo or tron legacy but i do not have experience with these so something that follows similar ideas that allows multiplayer shooting or objective based like teams claiming territory but more futuristic 100 futuristic the provides a lot of energy and bounce so aspects of a future generation like advances in technology really add and compliment that effect of the endofinput i was totally moved by the energy of the instrumentals it made me feel like i was in a lively outdoor jumping and moving with the crowd under bright lights endofinput futuristic cities with flying cars futurama esque at sunset endofinput i imagine an intense fight going on against a huge boss that they hadnt seen before endofinput the appears in the fight scenes endofinput a like cyberpunk 2077 the kind of that right before a shoot outfight endofinput rave neon bright fun endofinput a nice with friends endofinput very cool beat very intense and makes you feel like you head is going to pop but in a good way gives the impression that the drop is going to be great as well endofinput formula 1 race the cars are lined up to start the race then as the gets faster the cars start racing endofinput i imagined people running from enemies i imagined the start of a fight scene in i also imagined scenes from action endofinput the transformers came to mind i feel like its the same sound i have heard from the show endofinput it sounded like i was watching an action sequence scene endofinput sounds like its from that where you had to jump over things on iphone geometry dash that is it gunns redownload that now thanks endofinput it sounds like its from a 90s or early 2000s era fighting or shooting and this is the image that came to mind endofinput i see it in a but i also see it in an arcade that offers laser tag endofinput i pictured this as a a racing with the build up to the beat dropping as an introduction to all the characters right before the lights turn green for you to go endofinput 
53,videogame,Ele,Ele_LOW_14,VIDEOGAME-Ele_LOW_14,VID_Ele,me and my friends mario kart while i am trying to win endofinput it sounds like from a 90s or an arcade machine endofinput pac man some annoying from the 80s very irritating a sort of pixelated endofinput i imagined a pixelated combination scroller moving from left to right like paper mario and fighting like mortal kombat endofinput the captures moments of party celebration endofinput alive strong care freemind blowing endofinput i felt hyper and active it was like i was building up energy to go for or achieve something endofinput i envisioned a shooting for two players endofinput a gta and minecraft endofinput i loved this also and thought it was great it reminded me since it is used in a context that it is some kind of old style 8bit or nintendo 64 sort of like really old space invaders even and just other 8bit style that are pixelated nostalgic endofinput i can remember contra the guy with a yellow hair in the endofinput this was funky and engaging i was imagining a where i was running away from someone endofinput i imagined this being played in a car race it really brought the thought of how the cars move so first and navigate as i such endofinput i imagined someone a racing on their system something related to an old racing background endofinput a like motor combat where the player is competing with their competitor shooting each other out and covering themselves endofinput an 8bit style platform the player has reached the end of the level and is now in a boss fight the player knows the mechanics of the boss fight so is expertly moving around the arena dodging the attacks of the boss and damaging the boss whenever possible endofinput this was fun i like techno so this felt quite similar in style it made me feel like i was standing over a balcony of a club watching the debauchery occur endofinput a such as pac man in an arcade endofinput i thought of tetris initially and then pac man it brought up thoughts experiences of arcade in bowling alleys endofinput a retro 8 bit where your goal is to destroy a large alien mothership the bitcrushed explosions being the sound of you damaging the boss endofinput a group of nerdy coders thinking hard and trying to create crack a code they are working on their laptops endofinput i imagined shapes like rectangles squares from the tetris falling down in total darkness the shapes colours really stood out in the darkness the colours were pink green and blue endofinput pac man space invaders arcade tear or rip endofinput i imagined characters going through a maze in a it felt very techno and high paced like something was going down in a or a timer was running out to complete a mission endofinput i totally see hearing this in a it felt like i was mario cart again endofinput the sounded very retro and style with a action genre type sound to it so i imagined lots of different retro titles that i have enjoyed in the past which was fun i kind of also imagined an amalgamation of retro titles so it was like a cool mash up it brought to mind 8bit type ex endofinput i imagined an animated of racing cars endofinput i believe i have heard this in a old where you point and shoot at incoming objects endofinput arcade screens with like pac man and the spaceship shooter endofinput it made me think of a fast paced something with racing or futuristic levels the house beat gives it a really cool energetic vibe like you are moving quick and escaping opponents endofinput i pictured an old platform where you are in the middle of a fight running from monsters endofinput space invaders but also people dancing endofinput i get the feeling of being in a retro maybe something like mario or sonic and collecting coins or battling enemies endofinput 
54,videogame,Ele,Ele_MED_19,VIDEOGAME-Ele_MED_19,VID_Ele,i thought about a memorial because of the dark beat at the beginning it began to get more upbeat so it made me think more optimistic thoughts endofinput those short minutes before the episode starts where they the soundtrack that is what came to mind endofinput sounds like a cutscene showing the main character living their everyday life after they have left a covert mission they are just in a nice flat drinking some wine while relaxing endofinput this reminded me of that sex scene in cruel intentions between the main characters there was so much emotion in the scene and it was very intimate endofinput for this i imagine an older man with medium length grey hair and glasses pictured in a cafe diner with a hot drink with steam coming out pondering something with serious intent i image from this the scene zooms out showing him through the window an a wider shot of the city which looks like a gotham new york type of city is displayed it is also raining and dark endofinput when a character is deciding to change their ways from negative to positive it sounds somewhat motivational endofinput when the first started the first thing that came to my mind was the slow and depressing of a character dying in a once the bass kicked in i was thrown off by that and my mind shifted more towards two people hanging out and the just being used to drown out the conversations they are having endofinput the beginning of an adventure everyone gathered together to start the journey endofinput the sound made me thought of being with my love partner endofinput at first until the percussion other than the kicked in it reminded me of ambient like in fallout or minecraft once it kicked in i was reminded of like hexic endofinput thoughts of when the is about start endofinput i imagined walking through a forest at night time at first with a crackling fire nearby then the pace of the picked up and i imagined myself walking with more purpose and admiring the night sky endofinput i am imaging this to be during a short add about the olympics showing multiple quick different athletes in different sporting environments that they partake in endofinput i picture a guy struggling but preparing himself for the physical challenge he is embarking on endofinput this seemed like it at the end credits of a making the player seem sad that its over probably due to the ending of the being tragic and sad or just being a sad conclusion to the story endofinput i think this is one of the disks in minecraft endofinput a person slowly gets up to get ready for a battle where he lose his life the later parts where the beats start is him getting up and slowly walking towards the exit to enter the battle endofinput i pictured a random an rpg endofinput i am suddenly reminded of the 2010s this type of was popular and i heard it all the time during junior high and high school i can hear it on the television such as americas got talent or the voice endofinput gave me images almost like walking through a forest among the trees when its raining endofinput i imagined a tranquil landscape in the arctic and then suddenly polar bears appear clapping and stomping along to the endofinput imagined myself listening to street who perform in the middle of the street endofinput i imagined a girl calmly the then a guy coming up and banging a next to them maybe trying to disturb her practice the sound of the did not really match well with the slow sad endofinput sounds maybe like mourning but also pumping up character to go on endofinput in a maybe this is the cutscene where the character has really gone through some things and is losing hope until they find it again endofinput i love the the beats are hitting differently endofinput minecraft as a small child with my friends endofinput at first i thought it was a sad scene from a but when the beat started it reminded me of in a beach in a chill out with cocktails and sun endofinput on the home page of a whilst navigating endofinput i imagined an atmospheric environment in a maybe based in a desolate city in my head this of takes place after a big cinematic event in the endofinput sounded like something youd hear in red dead redemption endofinput i imagined rihanna performing this in a endofinput 
55,videogame,Ele,Ele_MED_20,VIDEOGAME-Ele_MED_20,VID_Ele,i see a loading screen for a an anime girl sitting on a seat in the window knees to her chest its cozy but also futuristic outside the window it seems to be raining above a cityscape we seem to be very high above the ground the clouds are blocking the view downwards endofinput i felt a spacey and chill vibe in this endofinput this gave me a nostalgic feel of with cousins in an afternoon during summer endofinput weird alien vibe kind of imagined a surface of a planet with nothing on it endofinput it sounds like a background used in especially when the characters are not having conversations endofinput this reminds me of when i am in the cinema before the adverts start and they kind of slow like this endofinput a between two participants endofinput a phone background that comes when starting the endofinput i imagined being on a table at a spa retreat getting a massage endofinput since it said this reminds me of a water level maybe deep underwater safe but lonely a bit moody but also gentle it feels like for someone to walk and contemplate to it also work for deep space but it feels so much like water to me endofinput transition at a endofinput i felt relaxed and at ease endofinput i am imagining myself watching a nature documentary specifically about the ocean i can see fish swimming around and the overall vibe is serene and calm either that or i am a that is ocean themed and this is the main menu endofinput calming spa like but with bag pipes west indian style endofinput i was reminded of the reverberating echo like background sound found in some by the artist bones like the klebold endofinput i found myself picturing scenes characters or environment that fit the theme endofinput it reminds me of my old smartphone endofinput i imagined a menu home screen on a gaming console in the 2000s the reminded me of the elevator typically heard while on the main menu endofinput in a football when selecting players or adjusting the settings endofinput it sounds like a trance endofinput honestly it brought sad emotions i imagined myself being distant a scene where i was lonely endofinput i was thinking of a scene where the main character receives a revelation that shocks them and makes them question their world view in the scene that i imagined they were being told by a benevolent woman about the truth of their situation endofinput it sounds like the menu for a that is set in a cyberpunk world i imagine the itself to be very blue hued endofinput reminded me of the sound machine testers walmart used to have where you press button icons and then hear a sound it reminded me of one that have a water droplet hitting the water but the photo captured it hitting with the ripple effects endofinput felt like the transition between at a the volume and slow pace probably contributed to this endofinput a relaxing where someone uses it to wind down and get some rest by napping or going to sleep endofinput 
