,context_word,genre_code,clip_name,ClipContext_pair,GenreContext_pair,textMIMC_lvl1b
31,concert,Met,Met_MED_20,CONCERT-Met_MED_20,CON_Met,i thought about being in a with friends i can see myself looking to my right and left and being in the middle of a huge body of people i can see me and my friends jumping up and down and enjoying the solo endofinput one of those white people where the artist a and they go wild but its like a niche thing only known to his fans endofinput its a the crowd is one big mass and everyone is surging forward lots of lights and some fire around the stage while the is dancing and endofinput this sounded kind of like the last one so it made me think about the same thing someone i used to know that was in love with the kiss part of those memories were not good so this just made me sad again i thought about sitting in the living room and hearing him jamming in his room endofinput for this one i imagined hero in some sort of gaming an i was hitting the solo while there was a massive crowd surrounding us for some reason i also imagined an arcade dance floor below us that wasnt being used endofinput a teen about superheros this as they save the day endofinput this is very fitting for a seems like a rockstar endofinput my mind instantly went to avenged sevenfold they were one of my favorite bands growing up and this sounded exactly like something i have heard before the solos really gave me an uplifting mood and made me sit up in my chair i love like this especially while working out or driving in the afternoons endofinput the climate of a where everyone is into the endofinput i thought of watching with that sound endofinput thoughts of the on the stage during the live in an open place endofinput i imagined being a passenger in a car on a late night road trip on a hot day with the windows down dancing along and air to the while laughing with the driver feeling carefree and happy endofinput i have heard similar played during mostly as special hidden easter eggs you can activate a strange thought indeed endofinput it be a on a large stage many pyrotechnics also be involved endofinput i imagine someone on stage in front of a crowd being excited endofinput i imagined a man dressed in all black with long black hair and dark makeup holding a and it with a lot of passion endofinput it makes me imagine someone riding on a horse into battle someone in armor with a big sword endofinput this is probably during a high intense scene of the performance with everyone screaming an shouting i imagine headbangers in the crowd and mosh pit everywhere endofinput sounds like the opening for a shonen anime endofinput anime opening endofinput i see this being used in a 3d sonic the hedgehog oddly enough i also felt myself the and shredding it up right along with the on stage or the studio performing endofinput made me think of my emo days growing up when i listen to bands like black veil brides and other 2010s a fun time when i had a lot of hang outs with friends endofinput the double reminded me of hero and that also brought up thoughts of dragon force i imagine trying to get the combo and going through the rhythm of the to get as much points as i can possibly get endofinput this felt like a to listen to as i have heard many similar and it was fun to listen to and compare to the past endofinput i see a in hair attire riffing in a crowded stadium endofinput at a and a performing and the player having a solo endofinput i imagined myself as a kid hero it reminded me of real memories i have of that same thing although i do not recognize this endofinput my friend who loves this type of endofinput my thoughts were when i attended a they always tunes like that endofinput seemed like a focused on and pumping up the crowd to follow along and vibe with it endofinput i liked that one it had a very cool riff it makes me want to go to a or a festival like glastonbury endofinput a on stage the with big like a heavy endofinput i pictured this being played at a huge stadium it was very dark and the on stage are shredding their and people were going crazy there were flashing lights and fire effects on the screen behind the stage people were moshing endofinput i imagined a making lots of noise on a stage i did not think id enjoy this endofinput a made up of teenage white kids in the garage endofinput 
32,movie,80s,80s_LOW_02,MOVIE-80s_LOW_02,MOV_80s,sounds like a scene set in a big city where the main character is depressed or wandering the streets at night endofinput i see a camera panning around a raining city somewhere hidden along the street is a where a detective is having a drink hes down on his luck and think the culprit is going to get away but a woman is about to enter the with some important information for him endofinput it felt very emotional and swinging towards the sad side maybe the hero in a just got hurt or died endofinput this gave me the vibe of an erotic with a romantic scene and mysterious feel endofinput reminded me of a cowboy riding his horse over a sand hill into the desert smoking western style endofinput sounds like an attached with emotions and passion i say its appropriate for staged as well endofinput i imagined driving home after a stressful day at work and with the thoughts of how life has been unfair with me in areas where i gave in my all and did not get to achieve my goals endofinput a beach on a tropical holiday island at night the blue ocean gently splashing against the grey stone wall by the beach path endofinput i imagined a trip on a luxury style cruise ship makes me feel regal and elegant endofinput a black and white mafia where the protagonist gets told by the woman hes been slowly falling in love with that shes happily married he watches her walk away its bittersweet endofinput played at a dinner event endofinput the seems to be a background of sorrowful event endofinput i imagined watching an old on the couch with my girlfriend endofinput yeah this feels like a romantic or a romantic scene in a when the lead characters are dancing intimately and it slows down at the end of the night and they are still holding each other enjoying the moment winding down while focused only on each other or maybe outside of the party afterwards out on the sidewalk in the cool air while the characters ruminate over their experience together and figure out how to say goodbye for the night endofinput it sounded like i am wishing on a star and provoked thoughts of hope dreams and persevering for me i thought about my goals and what i want for the future endofinput just reminded me of being on a walk i tend to listen to this type of when i need a bit of alone time often when walking so this evokes some pretty strong emotion endofinput i was in miami around 2022 live with similar cool vibes made me feel relaxed endofinput i am picturing a sad sequence in a perhaps the characters have just had a falling out and one is walking around in the rain through a city as the camera pans around them endofinput in a romantic scene endofinput relaxing tranquil setting endofinput i imagined a large as well as a musician holding a i am not sure if i heard a in the though at the beginning of the i imagined gothic architecture such as a gothic mansion with tall iron gates i also envisioned a romantic cafe scene in a city like paris with couples seated together and cups of coffee emitting steam into the air endofinput the made me imagine moments from my past that resonated with me endofinput it reminds me about me about my dog endofinput a romantic date night with my partner saxophonist around dinner that sort of thing endofinput i imagined an 80s with a woman walking by herself on a beach at sunset her hands are in her pockets the wind is blowing her hair and she is contemplating life endofinput most probably the ending where cast are being mention and other people who were involved in the making of the endofinput i imagined a wedding endofinput i imagined a romantic scene slow dancing with my partner and having an amazing night out endofinput the scene that came to mind was a scene in a where everything had gone wrong for the hero and he is leaning against a wall rain falling down around him wondering when everything started to crumble and how can anything be made right after it all collapsed endofinput i thought about a scene in a where someone likely a man be walking home alone after being rejected by a woman romantically endofinput another detective story the detectives partner had just been murdered and he sits alone smoking in a they were friends maybe a bit more than that in another life time he knows he can not work this case but damn it if he wont try everything he can to catch the killer endofinput sounded like at a restaurant endofinput feels like something you here at the end of a it belongs during a credit scene in a very relaxing endofinput 
33,movie,80s,80s_LOW_06,MOVIE-80s_LOW_06,MOV_80s,i think about an old sitcom this sounds like it be in the opening it feels like this be about a familial show where there are many happy moments endofinput it sounds like the track of the end credits scene in a happy family everyone is shown to be laughing and having fun whilst the credits roll endofinput this made me think of a 90s tv show where they are trying to show each character one by one doing a short scene and with them ending up looking in the camera with a smile or a crazy look something like frasier or cheers endofinput i imagined a happy scene in an older for some reason rain man popped in my head and the woman from that was the main protagonist in this visual it shows her in a drinking some type of cocktail and watching a live with the woman wearing a glamourous and sparkly dress endofinput ending scene from a 1980s where the two characters get back together and kiss endofinput this sounds like an end credit scene from a that either be a comedy or a romantic comedy endofinput this sounded like an introduction to a sitcom such as full house or rosanne my mind instantly went to an image of the screen introducing the characters them doing a silly pose or something and then moving onto the next character endofinput two people dancing in each others hands with the world behind them endofinput the sound is amazing and i imagined myself dancing with it endofinput i thought of being in an office or waiting on hold when i heard it can invoke that in me sometimes endofinput the thoughts of the trumpet being played keeps ringing in my mind endofinput i imagined a scene at the end of an 80s where the main characters of high school age are all dancing together at a dance with a montage of each character and how their story continued beyond the endofinput i get this feeling this be for an outro of an old school teenagers highlighting different characters with the credits rolling endofinput it reminded me of an 80s style so i imagined a sort of romantic sunset like scene with a load of purples and orange hues it was very american 80s too but it also had a grainy look to it endofinput i imagined the ending of an 80s maybe a comedy or romance and the screen fades to black to show the credits with this in the background endofinput it makes me think of an animated it sounds free and colourful endofinput near the end of the where everything went well for all the characters everyone is dancing and happy laughing and joking with each other as everyone all worked at in the end endofinput chill endofinput scenes of the city a tropical city like miami and or los angeles endofinput it made me think of dance from the 80s or the credits to from 90s or 80s the rom comedies and other comedy endofinput i had the imagination of the beginning of a sitcom the ones like reba home improvement or even everybody loves raymond i also imagine a studio set with the audience at the back to add to the laugh tracks at the same time i also thought about the beegees just loitering around endofinput this reminded me of 90s 2000s sitcoms like family matters and other similar shows endofinput a restaurant we visited las weekend endofinput mostly the terry perry is what i thought about black americans having a party endofinput the sounded like the type you hear in opening credits to a or tv show or even possibly ending of show to announce character names and titles endofinput i thought of a 80s 90s sitcom rather than a i tried to think of a specific one but not come up with one endofinput i imagined a at a as a sort of warm up for the main act where people are mingling and waiting around endofinput something i expect to hear on the radio or when visiting a theme park endofinput i imagined the credits rolling at the end of a with this the was giving rom com vibes with a light hearted ending and this gives that impression to me endofinput i imagined a wedding party happening and people dancing also i just missed what the attention check asked me to type it said please type the word did not catch the word but i was concentrating endofinput i imagined a 90s show with vibrant colors and wild hairstyles endofinput 
34,movie,80s,80s_MED_08,MOVIE-80s_MED_08,MOV_80s,sounds like something from a sitcom endofinput watching a kids show with my young child and then they start dancing endofinput the evokes the feeling of longing in a new place or destination endofinput soothinginteresting laughter endofinput i felt like i was a character in a and positive things were just happening to me so i was in a good mood or a mood for celebration endofinput this one reminds me of my ex boyfriend who loved these types of and also i like watching and i have heard it several times endofinput i imagined a celebration kind of like the ones during christmas season endofinput it sounds like a used where a family is traveling for a vacation by road endofinput i imagined a scene where a person is driving while listening to that endofinput i do not know why but this just simply reminded me of a character walking down the street in a that was jolly and happy because of something that has just happened one thing that led to was me thinking about spiderman and how there is a scene where peter parker is walking down the road to the raindrops keep falling on my head and he is happy i imagine that but with this instead like a happy for a happy scene endofinput lady in a red vintage ferrari endofinput i imagined myself in church because the sound on of the sounds led during the section endofinput i imagine a scene where i was at a quiet place trying to find peace within me no one was there just me and endofinput i imagined the opening scene of a where an actor is driving in a suburban area enjoying in his or her car endofinput a scene in a romantic comedy where the two leads are starting to connect potentially doing something fun or engaging for the first time endofinput typically a dance scene in the or when its the end credits and they are showing a reel of what their future lives have turned out to be endofinput for some reason i thought of a screensaver i have seen it is artwork of a tropical beach with a pink and orange sunset endofinput i do not know why but i am in an ice cream shop the shop sells banana ice cream has a pastel color pallette for its interior the floors are checkered tiles and for some reason they also sell balogna ice cream and have it as a topping they also sell pistachio ice cream endofinput end of a comedy series show and the cast are happy and waving goodbye to the crowd camera it is the end of the show endofinput dancing sunshine yellow frothy seas sand party young people endofinput i feel like i am listening to a michael jackson endofinput i thought about bingo parlours as it felt like an older that i mightve heard on the radio back in the 2000s sounded like a 20th century lots of and vibes endofinput it said but it did not sound like a at all to me so i decided to just enjoy the and then i started to randomly imagine banjo kazooie as i feel like it suit that and i played it a lot with my siblings as a kid on the nintendo 64 endofinput i imagine seated behind the car with my parents driving taking me to school on a bright day endofinput i was imagining a person happily going about their day in a endofinput a scene in a a car pulls into a driveway and a typical suburban family steps out of the car endofinput i imagined a stylish scene in a someone walking through a city at night the mixes classical with a modern hip twist making it feel fresh but also a little fancy endofinput i pictured it as the introduction to a about a family and the was basically like the family introduction showing each person in it and their name cards sitcom style endofinput this gave the imagination of reaching the end of a family an old one and reaching the credits where this is as we see the credits roll up endofinput 
35,movie,80s,80s_MED_13,MOVIE-80s_MED_13,MOV_80s,imagine it in a science fiction endofinput i imagined the korean i used to binge watch when i was around the age of 14 to 16 i had just gotten back from school and after getting my assignments sorted out my favorite korean show was next in line endofinput it sounded like it be an introduction to some romantic tv show or endofinput it sounded quite different and you hear the voices but not specific words endofinput two adult lovebirds dancing over the at a or party endofinput my parents being in love back in the days i recently came across a picture of both of them holding hands and the moment the began the picture flashed through my mind endofinput it has a gentle acoustic sound with a relaxed feel perfect for unwinding endofinput the is on my car radio i am driving from the grocery store and i am enjoying the evening endofinput its like i am floating above my thoughts watching them pass like clouds i do not need to solve anything right now just breathe just be this is peace in motion it gives me a meditation vibe endofinput opening scene for a twilight endofinput the sounded cool more classical or soul endofinput it reminded me of the part in a romantic where the couple have a falling out or break up endofinput before the fully kicked in i was imagining frozen there was a sound that sounded like a bell ringing and it made me think of the sleigh then after there was a change in i had no thoughts endofinput the night sky with shiny stars and moon like something out of a science fiction but with bad effects endofinput a fantasy inspired advertisement for a refreshing cold drink endofinput i imagined the opening scene of a with slow motion a family of 6 in a park running talking laughing having a picnic lots of cut scenes endofinput this made me imagine a rainforest with tribes people with a very peaceful feeling to it i felt happy and relaxed with nature endofinput it gives me nostalgic 90s vibes some of it relates to kate bush or bjorks a little bit so it gives me ethereal and angelic vibes but with a hint of 90s 00s downbeat pop in terms of the scenes imagined it matched the visual aspects of the artists mentioned so a more mature older vibe quite serious and romantic endofinput it actually gives a church vibe i felt like i was in this church with bright lights streaming through stained glass windows endofinput a introduction where they show the production company one that no one has ever heard of or will ever see again as its been set up for this alone and then it runs into the opening scenes of the endofinput i imagine this in a comedy romance where it is a love at first sight endofinput the opening title of an 80s probably the view of philly in the sunrise spanning across the city endofinput pixies fairies gentle pastel colours sparkle enchantment fantasy endofinput a character walking down the streets endofinput scenes of a very famous at an intimate full of loving fans endofinput i imagine the introduction of a its common to hear such as they state who the producers and actors in the are endofinput sounded like a introduction soundtrack endofinput an ancient eastern beginning followed by a more progressive path endofinput i imagined quite an old set sometime in the 80s i pictured this accompanying those old school intros they use to have introducing all the cast and the producers endofinput i picture this walking into a family restaurant that is friendly and welcoming endofinput 
36,movie,Ele,Ele_LOW_09,MOVIE-Ele_LOW_09,MOV_Ele,sounds like a car chase action scene endofinput driving a flying car in the future and weaving through traffic endofinput it was like a science fiction cyberpunk style space scene building up to some massive fight endofinput seemed like an adventure maybe a scene from blade runner endofinput the only thing i can think of is a dance night club with everyone a black shadow and bluish white lights flashing about endofinput the relates to overcoming struggles it sounds like victory endofinput just setting the mood to have a competition or something with a friend or colleagueits like a battle endofinput i imagined myself building up energy for a competitive race and the tension was high and for some reason i think i am going to win endofinput this one is still fresh in my mind just yesterday i watched a horror and this was the theme tone endofinput i imagined an action where someone is being pursued by villains endofinput a long drive way in a scene endofinput i thought this was great and it just reminded me of john wick or other action where in which the is in the build up to a shoot out or a race where something great and heroic is going to happen loved it made me feel nostalgic and happy endofinput a young man running endofinput this built tension and sounded like there was going to be an epic drop it made me feel a little bit on edge and aware of my surroundings endofinput i pictured an image of an action where heros and fighter are assembling to go for a rescue mission endofinput the gave thoughts of an action where it is at its climax endofinput an action scene is about to start maybe some sort of chase scene where the protagonist is getting chased by somebody at the start of the the protagonist is realising they are being followed as the continues the protagonist starts running weaving through pedestrians obstacles and traffic as the becomes more intense endofinput when hearing this sound it reminded me of a scifi or series where they were racing or battling the bad guys endofinput i envisioned keanu reeves i think because similar features in both the matrix and john wick of which he stars in endofinput sounds like the beginning of a epic fight endofinput somebody was in a cyberspace realm that was glowing blue with lots of digital fractals on the walls they began moving faster as the was building up getting ready to breach the firewall lol endofinput detective good guys in deep conversation thinking about a plan then they realise a plan so get to work endofinput i imagined someone in black running away from a group of people that are shooting at them the person in black jumps through a window and they start falling in slow motion with the glass falling slowly as well endofinput it just sounded like a sound from an action adventure and it made me think of tom cruise endofinput watching a endofinput i imagined this in the background of a tv show or about racing and the racers are walking onto the track to get into their cars and the camera focuses on each important racer one by one endofinput sounds like a that for the credits at the end of a endofinput it said so i imagined what type of it fit as a soundtrack and figured probably action or science fiction but then it also gave me strong vibes so i started picturing that a bit too i have been very interested in terminator lately so i imagined parts of that and the based on it especially the retro ones although it does not fit them exactly endofinput i imagined i was watching a of need for speed where cars were racing endofinput i thought of some teens or young adult women at a techno with light flashing and people dancing waiting on the beat drop endofinput an action with neon lighting people are racing cars down the street endofinput i imagined a scene where something big is about to happen the feels suspenseful like everyones waiting for a surprise at the same time the hip beat makes it feel modern and cool endofinput felt like a like a battle was about to start with big space marine looking guys endofinput i thought about introduction of my favourite series the introduction makes the experience of watching the series unforgettable endofinput this gave the feeling of being in an action like a car chase and you are weaving through traffic as stuff is happening all around endofinput 
