,context_word,genre_code,clip_name,ClipContext_pair,GenreContext_pair,textMIMC_lvl1b
12,bar,Met,Met_LOW_09,BAR-Met_LOW_09,BAR_Met,i imagined that i was with a group of people and opposite to us was another group and we were about to clash into each other similar to a mosh pit endofinput the opening sounded like something out of an action then the growling made it sound like generic in a scene endofinput the evokes the feeling of a road trip with a couple of friends endofinput makes you want to dance care freely like jumping moving your baddy all over the place just without pattern just to make you feel alivethis sound shakes you up endofinput i felt like the scene was a and roll and the was hyping the crowd up as the was just about to begin endofinput reminds me of my college days when i used to party a lot endofinput in a it sounds like someone is performing to entertain the guests endofinput thought of a dj the beats on an open while people are dancing endofinput i found it quite hard to imagine this being played in a it felt more suited towards a pub or some kind of specialist place however i picture lots of people at the dressed in black leather studded clothing and rocking their heads back and forth with tattoos endofinput i imagined being at a festival with my friends while the sun is shining and i am happy endofinput i imagined watching an action as it starts endofinput a loud and crowded full of all kinds of people including motorists who love hard endofinput if this was in a i walk out i also did not like this but it did make me think i was about to start a war or head into battle but this was very unenjoyable endofinput heavy at a or small venue endofinput feeling of nostalgia i was very into alternative as a teenager endofinput i saw a silhouette of thor as he raised his hammer and lightning struck revealing his visage a warrior wearing an elk skull rose from the ground with his mighty axe in hand and he began charging endofinput out of town people walk into a remote redneck pub it filled with men with long beards endofinput tank war energy drink endofinput watching wrestling endofinput i imagined a dragon flying in the air with its wings flapping and a camera shot panning on to its sharp and white teeth it also started to breathe out flames during the part of the wear the vocalist was slightly screaming endofinput i not enjoy this if i heard it at a i am not into endofinput the context prompt said typically heard in a but the sounded like heavy so i wasnt sure what to imagine since i have never been to a that played like that so i kind of just let my mind wander and do its thing which brought images of a by a like kiss or disturbed and that was cool endofinput i imagined sexy ladies slowly swinging their bodies to interest and attract men endofinput a the members have long hair and are headbanging on stage while this endofinput this one made me think of being in a lively with friends on a friday night the is upbeat and has a cool edge to it like everyones just relaxing laughing and having a good time endofinput a death at night with the punk rockers in the crowd going wild and fire effects on the stage next to the endofinput imagine a and people head banging but not in a setting endofinput this gave the thought of being at a everyone is nodding their heads forward to match the beats endofinput 
13,bar,Met,Met_LOW_14,BAR-Met_LOW_14,BAR_Met,i think about being in a and doing something with a lot of action involved i think about a sport or basketball with friends i also think about running on a treadmill and i also think about lifting weights endofinput this prompted the image of a fight scene both people engaged in heavy combat using swords i did not imagine a more like a dimly lit room with the two people in the centre endofinput my exboyfriends step dad loved the kiss and he always their in his room and that is exactly what i thought about when i heard this it brought some sad memories because our relationship did not end well endofinput for some reason this one i envisioned seeing a live and this is what they were planning i imagine the headbanging with long curly hair an a vest denim jacket with one of those that are shaped like a v i also imagined dragons in the arena for some reason assuming they were fake and not real dragons endofinput similar to the last sound that was played this sounds more like an endgame boss fight in a as opposed to something you hear in a when i think of i do not think of this this also reminds me of being on the final boss of a and having to truly lock in to beat the boss endofinput the sound made me thought and imagined myself in a fight against an opposer endofinput the way this is put together sounds much more like the score from a than a or anything you hear in a maybe an action during a boss fight endofinput thoughts of a with disco lights on flashing all over the place endofinput i immediately thought of the tv show stranger things of an inspiring fight scene between the protagonists and the villain lots of red and orange colours 80s style clothing and lots of cut scenes to different protagonists winning their portion of the fight endofinput a small local some in the night of a local endofinput i imagined a fighting style type of with 2 people against each other and this in the background as the soundtrack to the endofinput it makes me imagine another battle scene an army just getting ready to pit themselves against the enemy endofinput i imagine that the is is not that filled but the lights are flashing everywhere and the bartenders look overly friendly because its that they like the is not overly fancy but it has some nice decorations to it endofinput i imagine it being played by some sort of scandinavian possibly also used in a horror endofinput science fiction or science fiction shows endofinput i see it being played and i see it being used in a soundtrack for a like castlevania haunting in a way endofinput it made me think of fighting and 90s and very fast paced action that evoke adrenaline feeling and shock it makes me want to dance too endofinput vampires just like castlevania even though i never saw or know what it is about but the one thing i know about castlevania is the dracula vampire i imagine a darkened evening with black trees in the background black bats are flying up in the air towards the castle that is looming in the distance you can barely see the slightest hint of a cape through the windows endofinput it was a fun to listen too as it reminds me of my days high octane football in tournaments when i was younger endofinput it reminded me of almost a heavy version of the you hear in zelda endofinput this made me think about headbanging and working out it does not really sound like something i imagine id hear at a endofinput friends party endofinput imagined myself seated in a with some guys to keep the customers excited endofinput it reminded me of boss in a no specific one i thought of a playable character dodging attacks from a large elegant yet opposing enemy repeated attacks endofinput this is not the sort of played at or at least i did not think it was surely it should be quieter at a endofinput the is giving club vibes the beats are so synchronized endofinput i not imagine this being in a i imagined it at a in a tent where people were going mad dancing endofinput i imagined a busy with blasting out really loud everyone drinking endofinput i imagined this in some sort of or i imagined a lot of men with long hair and vests on and they were enjoying the endofinput i imagined an action scene where the main act chases a bad guy in a bridge in cars endofinput 
14,bar,Met,Met_MED_19,BAR-Met_MED_19,BAR_Met,very upbeat and i never hear this in a it sounds like a or maybe end credits for a or something way too much going on to be played in a endofinput can not especially imagine this in a more fit a club endofinput its not even that i have a thought of where it should be i just do not picture that in a its more at home in a hero than a if i hear that in a i have to haul it out of there because this is some serious biker or something endofinput i imagined a scene at a standing in the crowd and watching a endofinput a solid which has a good beat to it i expect to hear this in a endofinput not your usual but more commonly heard at a party hosted and full of school teens endofinput chaotic and busy areas especially the busy places in new york city the traffic the rowdiness the noise etc i do not like such places i prefer a quiet and peaceful environment endofinput it sounded like the kind of id hear in a fast paced action scene endofinput it give the thought of people dancing angrily in a and roll with the heat sweat and puke everywhere endofinput the brings out a memory of a night drinking with my peers on a weekend feels personal and deep feelings endofinput the tune is entertaining endofinput i envision a midwest endofinput the sounds more like the that gets played at the end of classic endofinput reminded me a lot of anime opening i was visualising scenes from attack on titan and tokyo ghoul specifically in Attack On Titan of the characters flying through the air like they do in the opening credits and similar scenes for tokyo ghoul like memorable fight scenes endofinput someone hero with their friends laughing and joking endofinput i imagined two cars racing a red car and a silver car the background is hard to make out as they are speeding so fast swerving in between other cars the chase is intense as the silver car tries his hardest to catch up to the man in the red car he owes him a lot of money endofinput i imagine i am street racing in my old work town with my back lifted work car with a turbo charger again this flying 100 mph around corners with the lights off on a blacked out car is a good frequent memory endofinput heavy surrounded by people who like punk and dress in dark clothes wear piercings and drink things like rum or craft beers or stouts stuff like that the loud and people are loud and chatty but very friendly and good vibe to them i am associated in this setting quite a lot i frequent a pub with this setting much more over the traditional others endofinput reminds of friendship going out with friends over a couple of drinks endofinput my favourite local that this kind of its a bit grotty its open late its dimly lit and their carpet theres a feint smell of body odour endofinput i imagine this is either a intense chase scene or another fighting scene with a big boss endofinput the is in the arcade endofinput flames head banging loud shouting endofinput i imagined myself in a listening to endofinput it felt like my blood was rising a bit overwhelming but also like i needed to just let lose crash out and enjoy myself endofinput a people banging their heads dressed in all black outfits endofinput images of a punk rocker shredding a zoomed in on image of their fingers on the endofinput this also sounds like it be heard in i kept thinking where it fits more but since it was indicated it is typically in a i rested my case endofinput i imagined myself in an early 2010s party endofinput metallica stood around some bad boxy tv hero all with hero trying to thrash out a hard endofinput the opening titles for a fighting endofinput i see it more in maybe a store like hot topic or spencers as the in the back endofinput i pictured this as a with lots of guys with long hair and wearing black and leather lots of people pushed together in a crowd that looks far too uncomfortable for how much they seem to be enjoying it endofinput picture this on a boss fight or a tattoo shop more than anything else as its more fitting endofinput 
15,bar,Met,Met_MED_20,BAR-Met_MED_20,BAR_Met,i thought of where they are at a like school of or something similar and they are in a mosh pit endofinput i can see myself at the computer desk as a kid opening up spotify to see what avenged sevenfold was whilst doing homework on the computer and talking to some friends on facebook at the time the is loud and i can not hear what my mother is saying to me until she walks over to me and leans down so i have to take my wired headphones plugged into the computer tower off to listen to her endofinput sounds like some early 2000s hard or speed endofinput this reminded me of the 90s where the high school finally gets to perform the gig endofinput reminded me of two bands battling on a stage like in a competition felt very very loud endofinput i say it is still an mostly presented in a stage with live audience endofinput i imagined endofinput it reminds me of some sort of manga cartoon like pokemon or the which is about level 9000 nothing in particular just those kinds of programs endofinput a performing at a contest and the various guests cheering them up endofinput the sounds as if its played in a night club endofinput i imagined my girlfriends little brother hero endofinput this feels like a i might hear on my parents tv or in from closer to their time endofinput it sounded like a called parallel worlds by elliot minor and produced the same nostalgia as the tracks i referenced sounding a bit like dragonforce or black veil brides endofinput reminds me of going to live with my dad to see bands that we both enjoy the fills the room and everyone there enjoys themselves endofinput it made me feel excited i have heard it through wrestling endofinput i imagined a scene from a such as devil may cry the scene is action packed and the characters are flashy with anime style visuals the moves being performed by the character is almost in sync with the and there is an emphasis on the cool factor of what is being seen endofinput a gig endofinput i thought of sonata artica a that i like i also briefly thought that this resembles the of rob zombie but then i changed my mind this gives off power vibes there is a folk in argentina that makes similar i believe i imagined an animated performer with an electric on a stage inside a endofinput i wanted to put myself in a setting with that since it did not seem to fit in endofinput i imagined a loud american style diner in the 80s endofinput energetic uplifting like you are racing to a climax feel that the energy was rising quickly endofinput it reminded me more of anime than a setting ones that came to mind were naruto or yugioh i did not imagine a specific scene but i placed it with those shows in general maybe an action sequence of some kind endofinput thoughts of a live performance in a with a young and very energetic endofinput it sounds rocking endofinput it sounded like the opening scene of an action packed japanese animation series it sounded like i was watching baku endofinput i really clearly imagine this from a jukebox at a after this a thought that came to mind was that i see this also being used for a scene set in a possibly during a fight scene that is not really serious endofinput i imagined a situation where there are some biker looking people hanging out at a outside near a patio the is from inside the so the sounds a bit muffled from where they are standing endofinput it reminded me of scooby doo where they be trying to catch the bad guy at a and the is getting intense to match the portrayal of the characters endofinput again sounded like at a as it was loud and fast paced endofinput i thought of fighting you can such as street fighter or marvel vs capcom it had a vibe to it endofinput 
16,concert,80s,80s_LOW_02,CONCERT-80s_LOW_02,CON_80s,i thought about my dad being in a my dad loved and wherever i hear it i think about him this brought feelings of nostalgia and curiosity endofinput i imagined myself walking into an empty church building where the are being tested before church service endofinput it did not hit me right away but this made me think of the la noir like a scene where the detective is trying to interview the attractive suspect and she is trying to hide the truth endofinput even though there was not one present in the itself i visualised a huge orchestra in the background of a man with a on a huge stadium like stage the man was lit in limelight and with passion the player was also lit up with smaller stage lighting and there was a lot of mist in the air fog machine the scene featured a lot of blue lighting to make it feel as though the orchestra and sax player are underwater endofinput ending of a vintage 80s or 90s on the beach the two characters walk off into the sunset endofinput this sounded like introduction to a or i feel like i have heard similar in especially like mafia since that is set in the early 1900s i have also heard like this played in the introduction to a when they are bringing all of the characters in endofinput a romantic scene people dancing in each others arms endofinput the sound was really soothing and made me imagined it for my pet to sleep endofinput i was reminded of when my mom listen to when i was little things like this sometimes sounds very close to the 80s stuff endofinput thoughts of live when the trumpet is being played and the is so carrying or smooth endofinput i imagined a character in a fresh from a break up sitting alone at a darkly lit with a glass of whisky looking melancholy and lost endofinput i imagined more of a smaller in a club of sorts lights low and everything endofinput i think of a man with short blonde hair sitting at a and it whilst looking like hes really getting into the endofinput it made me feel like i was walking through a forest as it was so calming and surreal sounding i imagine the sun on my face endofinput played during a solo act the guy with the is doing so well that the whole crowd is excited and amazed by how well hes endofinput played at a club or a bistro endofinput  endofinput a sensual romantic scene with two lovers connecting also i can picture the instrumentalists on stage in an opera like setting endofinput makes me think of seductive women and those mysterious 50s where they solve crimes as well it is very secretive and fun endofinput when i heard the despite its despondent tone i thought about the man the dude who appears in eurovision and is quite famous i do not know why he appeared in my thoughts so prominently but he exists and is making the same motions with his own while being melodramatic endofinput i imagined a live performance i was sitting in a big theater and it was completely dark except for the spotlight shining on the performers onstage endofinput my previous girlfriend who love rbs and blue endofinput i imagined musicians at a cocktail party endofinput a sort of lamenting scene late at night kind of misty woman walking around aimlessly with her head hanging low dejected loss or failure as the feeling endofinput seems like a relaxing slow type of to calm you down endofinput the is relaxing endofinput i imagined a set up with golden lights to fit the tune of the and lots of people swaying and feeling the endofinput i imagined a on stage in an intimate venue the audience was sat at small tables drinking wine and cocktails there was ambient warm lighting and the sound of quiet chatter over the endofinput i imagined myself being on holiday and hearing a live this maybe as entertainment endofinput people in a ballroom in elegant dresses slow dancing on the floor endofinput 
17,concert,80s,80s_LOW_06,CONCERT-80s_LOW_06,CON_80s,very bland like lift or something not something i specifically think about or remember end credits again endofinput middle aged people at the endofinput i imagined walking in a clothing store forever 21 charlotte russe etc and hearing this blasting from the speakers endofinput it sounded like a bit played in a tv show or a very old not a at all endofinput it reminded me of the opening theme tune to the show seinfeld endofinput a usually played at a party especially in of the 90s endofinput i saw myself having fun at a dancing and enjoying the with friends from school we were having a reunion and just drinking gossiping dancing and everyone seemed happy endofinput it makes me think of a high speed car chase through a neon lit city endofinput i imagine its on a friday evening and my husband and i decided to go to a and catch up with some friends we find the one we arrive endofinput that is pop gives the feeling of having fun along and dancing at the same time endofinput i picture people in praise place clapping and raising their voice endofinput the tune gives a driving experience endofinput 1960s 1970s found in a sitcom endofinput sounds more like a i have heard in some classical events endofinput again i saw a lot of coloured backgrounds changing with the beat a kind of green screened person dancing like in disco style and a trumpet and a bass flying across the colours endofinput people dancing on a hot sunny day down the seafront laughing and joking and in their own world endofinput a random day in a sunny shopping district endofinput i imagined an end of the wedding with everyone from the being there the wedding was a success the couple are very happy and the characters are dancing at the alter everyones cheerful the names of the actors come up when a close up of them dancing comes on the screen endofinput free improvisation sort of jam it gave me the thoughts of a local city festival middle of the day middle of the town square road closed for the festival and free to all people of the city and aimlessly but intelligently in terms of the chords but nothing too experimental or extreme this is a good thing as it appeals to a more wider crowd old young and all in between rather than just one or the other endofinput reminds me of my last experience endofinput i imagined being in a lively dancing and singing along under bright lights endofinput city skylines at night smoky clubs new york chicago steamy back alleyways people dancing 70s clubs endofinput i imagine a friend group at a disco nightclub dancing their hearts away after a long day of work endofinput people are dancing at the disco people perform the soul train on the stage endofinput the final scene in an 80s romantic comedy probably the two main characters finally getting together set in new york of course endofinput sitcom theme 80s inspired family comedy endofinput dancing like no one else in a endofinput very talented can hear all included endofinput a solo performance on a 360 stage endofinput fun scenes of people dancing in a 70s disco a player appears and does a solo for the people dancing endofinput definitely a sound i have heard it before and it makes you wan na dance or keep dancing endofinput happy times in tokyo in the 80s endofinput i pictured a stadium sort of place with lots of tiers and people dancing and singing a long to all with happy expressions on their faces endofinput i picture this on a live show more than any type of like a live set or something like that more than a endofinput 
