,context_word,genre_code,clip_name,METdescr_prepLVL2,idClipContext,idGenreContext
41,movie,Jaz,Jaz_LOW_21,peppy like lift feels busy like need something maybe walk shopping center listen background endofasubhere fun supermarket shop come age endofasubhere tom jerry show use watch track playing background tom jerry mischievous usual endofasubhere cute little cafe simulator kind endofasubhere whimsical endofasubhere typical cartoon kid show endofasubhere circus see circus first time bring back endofasubhere like could soundtrack chase endofasubhere chill grandmother kitchen drink tea listening cook endofasubhere environment gambling place likely cassino people around busy try luck endofasubhere tune give ringtone vibe endofasubhere kid winter wonderland fairy tail endofasubhere like play kid game mobile game endofasubhere remind one mute comedy sketch endofasubhere child tv show like animated one actually exist light blue background sky colourful caterpillar walk buy house similar one peppa pig occasionally would someone play glockenspiel beater endofasubhere cute baking time challenge finish baking decorating endofasubhere stand elevator place would hear real life endofasubhere slap stick comedy type montage perhaps funny event combine bunch one loft lobby hotel could effective location well also give feeling old french film perhaps european non english speaking perhaps still comedy black white vintage old ambience endofasubhere kid endofasubhere felt like play piano tile fully focus enjoy rhythm endofasubhere could playing grocery store family walk aisle look grocery endofasubhere work office face pace environment maybe endofasubhere s tuxedo endofasubhere like farm endofasubhere annoy one would kid id say usually supermarket elevator really dislike overwhelm ear endofasubhere person walk work joyful mood endofasubhere xylophone play also people fun road trip endofasubhere popular cartoon animation movie could movie daughter watch kind popular endofasubhere like soundtrack child show endofasubhere like something harry meet sally woody allen endofasubhere shenanigan occur hotel maybe someone pull prank endofasubhere could see maybe one retro feel endofasubhere quite cutesy design specific sort store go purchase specific item region endofasubhere could introduction sitcom maybe silly something like endofasubhere ,MOVIE-Jaz_LOW_21,MOV_Jaz
42,movie,Jaz,Jaz_MED_02,christmas two people posh restaurant endofasubhere slow dance endofasubhere see stage instrument side curtain slow raise show beautifully dress woman sing endofasubhere could smokey club enjoy vibe endofasubhere seem like classic gentleman get home work smoke cigar taking hat endofasubhere felt like new york light orange warm room full people really warm vibe almost romantic happy cosy way endofasubhere like play endofasubhere romantic someone love dearly quite place u walk hold hand lot public display affection endofasubhere black white young beautiful actress stand turn head gazing someone like endofasubhere sunrise hollywood esque town quiet street orange sky discarded newspaper sheet blow around ground alley endofasubhere marilyn monroe black white leaning balcony moonlit sky gaze sigh endofasubhere watch romantic best friend also emotional one play symbolize either love break hearted tragedy endofasubhere seem play background trailer endofasubhere woman evening gown hair pull back dance talk low man suit endofasubhere feel like another high class restaurant evening feeling like character ask someone dinner adult professional thing play though like next step end start romantic relationship transition something noteworthy nice little casual super tense endofasubhere cocktail date girlfriend everyone sit relaxed atmosphere endofasubhere wed moment feel happy endofasubhere two character slow dancing old timey ball something base character well dress suit expensive dress two character focus ulterior motive spy someone steal object ball brief bit fun see male female sexual undertone partnership usually keep professional dance routine hard endofasubhere play room wife side endofasubhere old hollywood glamour style endofasubhere remind soundtrack bioshock well django reinhardt seem like type django reinhardt could underwater city rapture listen endofasubhere bring mind specific genre enjoy find character endofasubhere remind penguin batman maybe watch batman series play game sort play feature screen endofasubhere romantic date listening smooth weekend evening sort vibe endofasubhere walk snowy street new york city christmas time dark cold quiet light decoration hang brick townhouses endofasubhere probably romance endofasubhere peaceful endofasubhere wedding endofasubhere holiday felt familiar use celebrate season always cool play background even dinner happen endofasubhere could immediately play cheesy hallmark woman move back town meet former flame like indicator viewer start get close two old time sit laugh old use visit endofasubhere couple share first date nice restaurant couple eat dinner shot capture outside restaurant window endofasubhere someone sidewalk playing tip bowler hat floor front people stand around watch one throw change hat continue walk endofasubhere like play fancy restaurant endofasubhere fancy restaurant night time romantic evening playing background endofasubhere ,MOVIE-Jaz_MED_02,MOV_Jaz
43,movie,Jaz,Jaz_MED_07,cosy endofasubhere bedroom study important exam various book open read endofasubhere youd expect hear hero enter villain lounge noir endofasubhere speakeasy black white brown filter whose name maybe detective drinking hard day endofasubhere character cafe dim warm yellowish lighting endofasubhere fresh start new opportunity endofasubhere want alonesit lift foot small table relax itbe sip winebeing beach enjoy breeze air move skin endofasubhere felt like calm high end stressful day drink luxury drink enjoy even listen soothe endofasubhere like lonely man reflect life endofasubhere watch romantic endofasubhere instant hear guy play piano reason man probably wear suit stylistic fashion know harder harder also romance movie romance might play whilst play feel warm happy endofasubhere seat house balcony mind overcome thought endofasubhere pool side dinner date two lover dance meal endofasubhere couple romantic session together go dinner date fancy cozy restaurant endofasubhere main character fancy restaurant live band play wear tuxedo see behind main character sit centre frame table really nice look meal front bottle wine ice middle endofasubhere general lot couple dance slowly feeling love palpable air endofasubhere romantic first date dinner white table cloth candle dim lighting glass wine endofasubhere old time new york red velvet curtain endofasubhere felt like cafe drinking coffee smoke cigarette endofasubhere man betray close friend suppose finish job get pay thatd end lifestyle man come hq find friend take money hes sol burn bridge endofasubhere couple posh restaurant slow dancing close love endofasubhere laptop work busy coffee shop drink matcha latte people enjoy chat background coffee shop brown green aesthetic endofasubhere kind remind see base new orleans jazzy bluesy playing endofasubhere smoky room old movie glam woman dress endofasubhere coachella night endofasubhere restaurant set musician corner play piano suit people eat dinner tap champagne glass together cold glass bourbon ice melting glass endofasubhere men woman slowly enjoy restaurant endofasubhere pianist playing corner high end restaurant couple intimate moment dinner table endofasubhere quiet black white live band playing background customer smoke drinking endofasubhere two people share private moment dimly lit room feel smooth little mysterious almost like there hidden tension endofasubhere old sad rainy night probably main character look blue endofasubhere noir style beautiful woman smoke cigarette endofasubhere give feeling home heating get ready holiday endofasubhere ,MOVIE-Jaz_MED_07,MOV_Jaz
44,movie,Met,Met_LOW_09,corp nightclub sheffield saturday night aka bad nightmare grimy absolutely hate endofasubhere superhero vocal come mind go blank endofasubhere hero reach breaking point plan kick major butt someone mess wrong person he pack bag put clothes medical supply weapon anything may need take big guy leave industrial style apartment get big motorcycle drive endofasubhere like track last one seem like mashup endofasubhere woman get do wrong get ready go dish revenge endofasubhere remind iron maiden acdc overwhelm loud endofasubhere playing character run fight conversation endofasubhere invokes fear action do series break bad remind danger endofasubhere remind bit use play black ops zombie specifically kino der toten map endofasubhere end credit action dark superhero endofasubhere really remind bill ted bogus journey evil version murder good version remind soundtrack endofasubhere action fight hero villain endofasubhere like play background cinema endofasubhere people headbanging endofasubhere fight quite relaxing time emotion evoke endofasubhere outdoors hundred others crowd rowdy energetic band perform striking visuals effect endofasubhere band watch endofasubhere motorbike motorbike move fast pace city endofasubhere like something perform rob zombie maybe maylene son disaster concrete visual reference though endofasubhere want action endofasubhere favourite endofasubhere indiana jones search treasure like endofasubhere involve mostly preparation maybe hunt something endofasubhere running endofasubhere game endofasubhere play entrance wwe wrestler pyrotechnic shoot hyped crowd endofasubhere could use set atmosphere dramatic confrontation main character antagonist feel much like villain primary theme endofasubhere main character dark action get weapon tool ready plot take enemy endofasubhere monster truck box arena skateboard park rollercoaster place endofasubhere fit also something would hear endofasubhere edgy game like devil may cry people scream endofasubhere ,MOVIE-Met_LOW_09,MOV_Met
45,movie,Met,Met_LOW_14,mix thing together right mesh well much go sure part would fit confuse endofasubhere popular jason statham action watch year ago main actor chase bad guy cop endofasubhere someone put backing modern take mega man big fight like modernize rom hack endofasubhere felt envision suspenseful bos fight endofasubhere quite fast uptempo quite enjoyable would expect hear endofasubhere typical action specially involve chase sort endofasubhere bring thing chaotic mess lose job could straight back usually play hard could worry less endofasubhere like energetic powerful electric guitar endofasubhere watch tv show play show begin endofasubhere fight action endofasubhere rhythm tap something surface feeling quite name sad happy alive sync pulse night endofasubhere tune give cinematic experience endofasubhere close classic action early mid endofasubhere specifically fighting character selection screen endofasubhere someone play guitar someone look like jason momoa probably watch throne recently also occasionally anime endofasubhere part lead bos battle take minion keep come endofasubhere intense chase fight start slow motion run man catch another man ready throw punch man karate kick slow motion stop fight intensifies speed get faster endofasubhere protagonist chase villain endofasubhere felt like wait screen something science fiction robotic something go suggest shoot em police work endofasubhere boss battle old platformer like castlevania quite old endofasubhere give like spy vibe usually occur chase suspenseful endofasubhere evil character plan kill someone cartoon endofasubhere like soundtrack tense endofasubhere battle cyberpunk vampire set japan endofasubhere could feel also one similar sonic endofasubhere strike described non less sort chase sort endofasubhere ,MOVIE-Met_LOW_14,MOV_Met
46,movie,Met,Met_MED_19,remind one favorite wrestler theme entrance extremely similar watch wrestle live friend great time endofasubhere drummer get lit endofasubhere chase protagonist run city jumping thing whilst chase people weapon endofasubhere bill ted like go adventure travel time remind movie endofasubhere people crowd surfing throw thing onstage endofasubhere like cool montage cartoon rather actual endofasubhere mind instantly go back avenge sevenfold previous study love kind instantly get hype envision car listen something like work jam drum especially endofasubhere intense lot action either race running fight endofasubhere radical indicate imagination fight someone endofasubhere concert attend try envision could fit credit would high action part endofasubhere thought steady full blast eletronic live endofasubhere large gig huge crowd surround like minded people get lose atmosphere put smile face could exactly would feel moment endofasubhere like montage action pack uplifting beat sorta hype endofasubhere could someone play something guitar rifting key stage front crowd people endofasubhere intense fight dragon people dress like viking go war endofasubhere samurai sword fight endofasubhere scandinavian band feel would play heroic rescue endofasubhere anime open n roll endofasubhere felt fiery intensity normally get listen heavy headbanging goodness endofasubhere star people head bang fun want go club party endofasubhere remind quite closely sonic franchise sonic go around loop go fast obtain golden hoop different level difficulty endofasubhere felt like tune lot past party endeavour therefore invoke lot endofasubhere bullet valentine type would listen alternative person endofasubhere someone run chase baddie endofasubhere watch live stadium show band member look similar kiss perform also try hard recall artist know hear endofasubhere gym endofasubhere mind go car race game play win race endofasubhere would cool learn play guitar well know late learn band cool endofasubhere relax endofasubhere try part like action fast chase keep small new band endofasubhere something would something fun happen endofasubhere get headache listen kind painful ear endofasubhere theme beginning kid teen show endofasubhere ,MOVIE-Met_MED_19,MOV_Met
47,movie,Met,Met_MED_20,drive car really fast recklessly keep road endofasubhere like anime credit open title sequence endofasubhere idea weird would like avenge sevenfold sort use see kerrang endofasubhere resonate one lose night thought endofasubhere mild still fill fireit wan na put dance shoeslikes move dance floor even want endofasubhere rockstar partying play lead guitar felt energetic top world endofasubhere one several movie watch endofasubhere enjoy instrumental suitable band musical endofasubhere watch middle night endofasubhere lot power ranger tv show albeit movie still always part child show teens show style either japanese anime never watch latter entirely force spontaneous endofasubhere heavy lot fun endofasubhere thought saturday weekend relax home go work weekend endofasubhere high school party every one party fun endofasubhere actor deeply immerse play guitar part role friend listen basement drink smoke endofasubhere could fighting intense escape someone try escape someone something endofasubhere feeling joy immediately recognise band obsess teenager avenge sevenfold endofasubhere dragonball z fight endofasubhere manage pull excalibur moment need fend undead horde raise sky lightning strike eye glow begin charge decapitate ghoul ease endofasubhere group young people heavy dancing great sweaty time people wear black look busy jump endofasubhere previous listen remind two band use listen thing saw someone play guitar blurry stage background endofasubhere theme tune television cop show endofasubhere event endofasubhere could someone play piano quickly girl look slightly animate strum electric guitar colourful light shone endofasubhere context say like listen passively mostly although band fall reverse would really suit soundtrack generic endofasubhere watch teenager roll endofasubhere guy play electric guitar fight bad guy simultaneously endofasubhere exactly like hear band use listen call black veil bride endofasubhere someone get ready something big guitar drum feel intense like there something wild happen endofasubhere someone shred guitar endofasubhere watch theatre friend endofasubhere give feeling introduction teen comedy series character show screen endofasubhere ,MOVIE-Met_MED_20,MOV_Met
48,video game,80s,80s_LOW_02,mysterious endofasubhere break someone date long time start cry endofasubhere bit noir esque like dark detective set u endofasubhere felt like play detective noir black white endofasubhere two character noir detective black white early morning late night pm city endofasubhere relate idea new beginning endofasubhere warm musicwhen feeling tired alone ginger upit uplift spirt bit endofasubhere character reflect head help navigate thought feel grateful endofasubhere one one friend proposal day husband prank later whole place proposal come endofasubhere like character embarks adventure gather gem stone earn point endofasubhere play slow night endofasubhere sort romantic kind slow pace know actual context actually necessarily cutscene within kind like base cinematic sense feel much fence whether select yes endofasubhere man play piano dark room red curtain endofasubhere play mall shopping centre cool give customer time pay attention want buy endofasubhere sad two lover say goodbye great time time go endofasubhere purely relaxation show different landscape different attraction endofasubhere someone walk alone city streets alone night heartbroken long saxophone well sombre piano note endofasubhere thing passionate love two criminal together end credit roll complete endofasubhere remind video reason endofasubhere beach rooftop cocktail view sunset romantic date endofasubhere lean guard rail look ocean cigarette hand smoke white suit white fedora purple band find close friend die scramble get hospital save life dead inside endofasubhere man walk dark street heavy rain look upset light street light endofasubhere someone walk distance near subway atmosphere dark moody person unhappy endofasubhere remind one character walk city street dark endofasubhere lovebird endofasubhere much rain sad thought also weirdly frog pavement rain endofasubhere context prompt say really game play past try soundtrack might look play like end settle visual novel style certainly atmosphere could mechanic go visual novel style nature less kinetic narrative atmosphere endofasubhere seat house meditate life endofasubhere main character alone something touching happen rain fall outside city light glowing character sit lose endofasubhere rpg come mind small quiet town start journey know everyone endofasubhere end credit endofasubhere coffee shop listen endofasubhere type give sense adventure felt like walk along mountain meadow ready next quest endofasubhere ,VIDEOGAME-80s_LOW_02,VID_80s
49,video game,80s,80s_LOW_06,car ride endofasubhere see camera pan around somewhat busy street anime fly people laugh fun get different store front street introduce u new area endofasubhere remind old television type theme endofasubhere remind watch tv show child endofasubhere kind series rush plot type particular series endofasubhere like end credit detective show endofasubhere similar sonic overworld area sonic game really many game like like peaceful city area nice soothe endofasubhere remind embarrass tv infomercial remind level sonic adventure mention endofasubhere play participant online background one listen alsothe scenario football playing football listen would give much confide endofasubhere give traditional celebration endofasubhere wait line wait someone doctor office pick phone endofasubhere like celebration dance almost something positive energetic feeling also demand attention feel cool since state cool competent suave character come action something noteworthy follow lead maybe cause mayhem good time win thing arent super tense endofasubhere smooth radio vibe saxophone endofasubhere play chill slow game young stress free time sun shin outside play friend dinner ready endofasubhere sit family get ready play family orient party mario party play pick character generally main menu endofasubhere parlor dance endofasubhere remind era vibe endofasubhere bring mind grand theft auto vice city particular would play radio vehicle within seem evoke carefree atmosphere cool confident hedonism endofasubhere de ja vu play young endofasubhere protagonist action base zombie killer rpg run mall similar dead rise series endofasubhere youth endofasubhere wedding band cool saxophonist wedding dancing celebrating endofasubhere another compilation group friend shop holiday new york city go store laugh walk street etc carry large shopping bag snowy outside endofasubhere saxophone endofasubhere heard endofasubhere immediately persona series hear read would maybe play really strike would play certain setting felt tropical light would play maybe beach endofasubhere like type play credit roll someone beat likely wouldve fun something colorful family friendly endofasubhere end title sequence playing character blooper credit endofasubhere felt like would play end credit fast pace upbeat endofasubhere something would maybe food lounge people eat background endofasubhere ,VIDEOGAME-80s_LOW_06,VID_80s
50,video game,80s,80s_MED_08,overly upbeat real emotion peppy much endofasubhere self play nostalgic mobile play track go tutorial endofasubhere like opening theme closing theme sure sitcom gon na specify really take pic samey profile endofasubhere first couldve sitcom tv show drive around wario mario cart endofasubhere slight vibe endofasubhere adventure hurdle obstacle scale although obstacle may difficult endofasubhere saw lovely son eric act school drama time watch act proud similar perhaps immediately endofasubhere bustling city night light energy endofasubhere drive even sun set enjoy cool view nature endofasubhere summer night friend windows blast care world maybe life serious time cool chilly relaxation endofasubhere tune entertain endofasubhere dance romance endofasubhere like classic play family outdoor event endofasubhere giant man plod along street cheery grin face greet everyone walk past endofasubhere bubbly character stroll cute town hop mushroom endofasubhere group friend one one come different direction meet first man walk quiet new york street get happy friend come laugh talk together whilst walking endofasubhere play mario hunt star kill mob vibe play endofasubhere adventure play background user go around map inside outside building collect foraging accumulate item use sort fantasy world item collect save use later effectively good head bopping right frequency enjoyable distract endofasubhere like drive busy street gta endofasubhere could friend group beach conversating fun endofasubhere character arrive beach section endofasubhere platformer similar super mario probably old colourful endofasubhere dad dance bright colour saxophone laugh fun endofasubhere play swede game friend endofasubhere like old see appeal want dance feel like war time diner endofasubhere car driving towards sunset end endofasubhere big band people dance front grass late night concert endofasubhere joni mitchell sing walk broadway new york endofasubhere open area world quite colourful fun lot free exploration item find tucked away hidden place playing open world aspect endofasubhere ,VIDEOGAME-80s_MED_08,VID_80s
