,context_word,genre_code,clip_name,METdescr_prepLVL2,idClipContext,idGenreContext
21,concert ,Ele,Ele_LOW_14,old sonic original sonic map sonic run around jumping noise endofasubhere play contra bedroom sit floor back bed endofasubhere rave lot strobe lighting people jump huge room full people light strobe flashing light endofasubhere start start blade couple second switch classic game grow family gamers like bos metroid old doom game get power endofasubhere like modern rendition old street rage game retro feel synths crunchy like drum use like would perfect menu bit fighting like endofasubhere remind old sonic hedgehog game kind would hear play futuristic style level great representation feel like play level endofasubhere energize endofasubhere envision game try invoke retro field big festival like play endofasubhere old school arcade like pac man background play arcade simple repetitive yet enjoyable premise endofasubhere dj get ready play big drop hype crowd first section endofasubhere old bit take place space space ship shooting target endofasubhere dance friend spin round circle flash light endofasubhere start rave people start get hype start build endofasubhere disco techno retro club people vibe endofasubhere like soundtrack bit bit era game akin like mega man similar side scroller endofasubhere club well show teenager queer life exciting take back well time work responsibility endofasubhere remind contra old school retro game people play arcade back early could see main character use arm gun shoot enemy approach could also see different people arcade play type game like pac man dance dance revolution endofasubhere funky cyberpunk theme place fun perspective endofasubhere put mind school endofasubhere busy nightclub dark crowd loud lot people dance etc endofasubhere previous road trip friend play beat endofasubhere pianist entertain guest cocktail party endofasubhere remind breath fire first mario like fire breathing lead away turn base combat sort endofasubhere would expect especially effect like something old mario sonic endofasubhere like cartoon endofasubhere yes envision playing club ibiza lot strobe light laser endofasubhere dark man stage dj deck lot flash light smoke lively crowd lot finger gun wear sunglass endofasubhere people dance disco light endofasubhere ,CONCERT-Ele_LOW_14,CON_Ele
22,concert ,Ele,Ele_MED_19,like minecraft endofasubhere late night bedroom hear rain come tap bedroom window endofasubhere like youd hear indie endofasubhere track something take place beach overcast blue grey day cold water cold breeze endofasubhere share celebrate new bond friend endofasubhere interestinglovingmakes want dance endofasubhere artist get ready perform intimate crowd rock tempo build endofasubhere fresh mind attend several concert function lot great endofasubhere trigger thought ex girlfriend kinda emotional endofasubhere instrumentalist perform singer play singer start endofasubhere people practice dance move play endofasubhere soon drum start lady red start dance endofasubhere house soft working day would dance happily endofasubhere pianist stage play key singer dancer wait cue begin perform endofasubhere start feel sad like sit side fire alone winter upbeat fun spark joy optimism evening endofasubhere would chilled festival countryside woodland calmly dance endofasubhere give feeling calmness visual endofasubhere rainy day inside house high ceiling white interior large window overcast light fill room cause greyish blue color rain roll window cue next drive white car black road shimmer water rain dry aerial shot pan overhead drive next grassy meadow pensively drive like big ambition endofasubhere beginning funeral rain dress black black umbrella people speed sit car look window drive past city start go countryside endofasubhere run gravel pavement corner building endofasubhere karaoke acoustic night endofasubhere first vibe bit sadder could raindrops fall slab start get lighter tone could dj play piano festival endofasubhere beat great wonder kind genre whos would hear endofasubhere say context felt beautiful bit melancholy girl playing piano long white flow dress wistful expression first stage performance turn fancy interior outside forest really like second part come nice endofasubhere saw near ocean view listen person play piano another play drum begin endofasubhere remind familiar pop start slow get upbeat male singer endofasubhere big kind like summer festival crowd move beat light flash everywhere people sing along feel fun little hyped everyones good time endofasubhere come mind playing credit play endofasubhere rain piano endofasubhere organise private husband birthday endofasubhere type give feeling part main character actor drive road ready break vocal may signal sad endofasubhere ,CONCERT-Ele_MED_19,CON_Ele
23,concert ,Ele,Ele_MED_20,feel like underwater sea calming relax float around water endofasubhere vividly mobile phone ad use get back covid watch favorite streamer endofasubhere kind background hear big tech company major innovation sphere decide five minute long info dump explain dollar smartphone different one buy endofasubhere introduction screen kind underwater endofasubhere quite emotional endofasubhere nice chill vibe kind want relax maybe daydream little endofasubhere play advert product like oil endofasubhere pulse android ringtone alarm endofasubhere hard explain like colour colour tile change every note also keyboard float colour endofasubhere hot sunny day sun glisten sea bird fly person insight nature endofasubhere man slow motion fall sky screen fade black stop start see water slowly sink bottom endofasubhere deep techno track somebody like tiesto playing something large room dark crowd neon light show slowly build eventual large grand loud finish endofasubhere calm fan calm solo moment endofasubhere listen felt kind excitement like get ready big moment stage light endofasubhere could two people get serious fight place lie bed do cry regret endofasubhere come endofasubhere load patience loop endofasubhere slow soothe thought endofasubhere give nail salon vibe spa somewhere want relax feel peace one earth spiritual endofasubhere astronaut float space endofasubhere space fill futuristic slow moving endofasubhere like curtain raise track endofasubhere could tell prompt right endofasubhere sort weird wellness retreat force listen try meditate say healing focus feel unattached unlike one tell actually feel life endofasubhere melodic relax meditate something would listen relax meditate endofasubhere ,CONCERT-Ele_MED_20,CON_Ele
24,concert ,Jaz,Jaz_LOW_19,dynamic could see people dance somewhere similar jazzy fun upbeat endofasubhere club cocktail high end lady fancy dress men suit potentially people dance front swing style endofasubhere self audience watch live orchestra pay close attention small detail munch bucket p endofasubhere sort style anime maybe like baccano manner heist go background endofasubhere old like super mario something like endofasubhere id expect hear type la la land endofasubhere popular band play instrument perform enthusiastically crowd endofasubhere felt like live oldie thought car look back men dress cowboy wear lady carry hair dress endofasubhere like energetic strong beat powerful electric guitar endofasubhere meet robinson animated really enjoy endofasubhere self immerse environment fill people play instrument mood elevate lose fantasy lifetime fun endofasubhere tune cinematic endofasubhere band endofasubhere play classy restaurant event endofasubhere first remind alarm phone alarm go bed sort band play drum restaurant get go restaurant like overcook endofasubhere people dance happy like war finish endofasubhere old european inspire character get onto train carriage endofasubhere bank robbery man woman almost comedic man keep get stick thing like outfit behave like woman role eye shes try best take job seriously endofasubhere band slowly build tempo one instrument time dark club endofasubhere hard bop chicago new york stuff like mile davis charlie parker type energy real late night blue community cigar smoking real late hour enjoy real commercialise today people live moment distinctive chatter back close performer really small distance stage attend endofasubhere gathering endofasubhere actually felt like someone race time maybe tension building every beat endofasubhere cruise liner playing afternoon people eat small crowd good get pay play travel endofasubhere could group play night everyone dance heart drink endofasubhere people fox trot endofasubhere tense part require concentration quick work endofasubhere dj want keep crowd move endofasubhere bit uncomfortable like horror first talent band powerful hear beat endofasubhere cartoon character run enemy also inside old school club endofasubhere slap get late momentum amongst musician reach fever pitch endofasubhere villainous character something sketchy become enamour something else lose villainy moment endofasubhere literally could beginning mario brain could see idea entire time mario endofasubhere ,CONCERT-Jaz_LOW_19,CON_Jaz
25,concert ,Jaz,Jaz_LOW_21,one particular endofasubhere classic band playing everyone enjoy others company head nothing come right away endofasubhere ragtime like black white comedic aspect go nice restaurant similar film laurel hardy use stereotypical waiter one hand silver dish french moustache slip drop drink food also shot fast pace endofasubhere busy hotel swanky perhaps posh hotel maybe holiday endofasubhere spot light one player showcasing skill endofasubhere instrumentation many cartoon see fairly odd parent pop head especially endofasubhere child like jungle book baloo dance around joyfully character open area jungle endofasubhere scream elevator old classical black white people move around normally endofasubhere remind tv theme like frasier sit watch show endofasubhere packed everyone dress vintage fashion smoking drinking good time endofasubhere dance away swing endofasubhere probably use funny intermission different act allow people time need like performance endofasubhere doctor season donna episode doctor face invisible monster copy speech pattern train show begin two lobby new planet enjoy vacation donna say shes head pool doctor go solo trip endofasubhere see people play instrument hear stage endofasubhere cook game rush complete order little basic game basic task like burger coffee endofasubhere dude youtube showcasing different instrument lot show remind marimba performance even hear voice say marimba watch video right endofasubhere much tom jerry classic enjoy lot give nostalgia endofasubhere someone play glockenspiel circus area someone trick juggling arena endofasubhere group clown perform street xylophone colorful instrument rainy day endofasubhere therapy clinic take grandmother endofasubhere child ballet dance school endofasubhere since kind lively piano remind tv show frasier hustle bustle city people walk rush around endofasubhere wacky elevator design kid game thing look item endofasubhere want xylophone child would still cool one able play instrument general endofasubhere love beat instrumental endofasubhere upbeat people sit drink endofasubhere remind child small toy interact endofasubhere one person stage play xylophone small crowd struggle scenario would play endofasubhere like id hear kid show endofasubhere ballet class kid dance around tutu endofasubhere ,CONCERT-Jaz_LOW_21,CON_Jaz
26,concert ,Jaz,Jaz_MED_02,kid spend afternoon grandma jigsaw puzzle endofasubhere first great time la noir straight club prohibition era speakeasy endofasubhere first could browser window cafe ambient playing could see universtys starbucks full view saw inside though id step inside watch student sip coffee tap away laptop endofasubhere bring back ex partner endofasubhere peaceful serene endofasubhere felt like club enjoy musical artistry old experienced artiste relax life endofasubhere one every weekend church praise worship time always long sunday hear cool endofasubhere like artist performing artist likely instrumentalist endofasubhere person stage singing endofasubhere enter expensive restaurant endofasubhere play dedication proposal function endofasubhere musical band play instrument stage crowd slow dancing endofasubhere introduction crowd begin buzz excitement band way stage loud cheer erupt time one band member enter feeling tension within crowd anticipate entrance band lift endofasubhere feel like either cigarette smoke air listen bank seine paris past midnight middle summer endofasubhere date night city london new york city wine dine time loved one listen enjoy atmosphere endofasubhere noir roar wear zoot suit cigar mouth see bombshell woman begin talk shes able match energy even put toe talk begin fall love smoky dim light endofasubhere partner lovely steak restaurant endofasubhere like get dress apply makeup large mirror vanity messy clothes floor endofasubhere showgirl romance new york rain pavement romance endofasubhere band endofasubhere remind christmas michael buble also someone play saxophone man sing passionately serenade woman sing voice style similar michael buble men suit perform endofasubhere like symphony would attend endofasubhere theatre setting orchestra playing specifically saxophone soloist endofasubhere love two people affectionate one another endofasubhere outdoor middle big city summer people lay blanket grass around stage endofasubhere performance britain get talent endofasubhere whilst relax play background endofasubhere ,CONCERT-Jaz_MED_02,CON_Jaz
27,concert ,Jaz,Jaz_MED_07,restaurant maybe usa rather uk calm evening meal probably somewhere quite posh endofasubhere mind could see similar one might see couple dancing nearby color woman stage take break sing air fill smell cigarette smoke body odour endofasubhere feel like nice cozy nook endofasubhere give dim lit nightclub performer sing people side conversation well know establishment endofasubhere bell background christmas remind nice restaurant new york christmas time someone play piano specifically la la land guy ryan gosling play endofasubhere someone play piano audience listen endofasubhere holiday walk alone admiring nature beauty new quite calm city endofasubhere get mixed michael buble perform stage also hint james bond theme bring back around movie nothing particular endofasubhere sleek top floor apartment new york city piano maybe owner host party endofasubhere totally felt vibe bar feel like get cocktail hang night endofasubhere light dim full people dress suit fancy dress sip cocktail woman auburn hair green sequin dress sip martini watch pianist play endofasubhere hence come mind ball dance significant otherspending quality time together recreate endofasubhere melodious seem play colorful wedding endofasubhere quite man play piano corner endofasubhere feel like elegant high class restaurant like stage performance first would see fancy event endofasubhere new orleans cruise etta james endofasubhere room incense lit chill relaxed play whilst wind evening endofasubhere moment family vacation happy moment relax endofasubhere man stage play piano dimly lit room light shin stage red tinted man wear suit passionately lose play background band spotlight yet still somewhat visible overall vibe old timey one endofasubhere romantic date wife endofasubhere piano playing busy train station endofasubhere noir crime mystery film well two television series use similar matlock series air heat night like soundtrack mystery crime drama endofasubhere music quality resonate personal level evoke specific endofasubhere provoke thought fine dining setting endofasubhere old school underground cigar smoke fill air classical band playing fore front endofasubhere dimly lit fine restaurant club people mingle there live band play stage everyone wear black tie attire endofasubhere white party drink glass wine people dance share laughter endofasubhere calming serene endofasubhere really nice dinner fancy restaurant partner endofasubhere fancy hotel really expensive restaurant sort thing give endofasubhere could easily see female singer stage instrumental perform play behind live band play instrumental stand microphone stand nod ready come cue endofasubhere fancy club would play small band musician stage club surround people dress nicely look expensive rich endofasubhere black white detective sit smoking pan around opening title sequence case file spew front hes regular glass whiskey neat sweat next look crowd endofasubhere felt like would play fancy restaurant endofasubhere classical feel ease feel like slow dancing romantic partner endofasubhere ,CONCERT-Jaz_MED_07,CON_Jaz
28,concert ,Met,Met_LOW_09,heavy somewhere belong enjoy endofasubhere middle age men ride motorbike long grey beard mosh pit dark night time loud headbanging endofasubhere self watch bunch heavy favorite headset endofasubhere felt like melodic death band endofasubhere sort different kind expect bit shout hint endofasubhere cacophony noise synonymous mayhem endofasubhere suspense listen suspense movie suspense game real life suspense endofasubhere energetic strong beat powerful electric guitar endofasubhere road trip kid group teenager drive past u van high volume play endofasubhere yes use listen roll actually due emotional relationship issue back endofasubhere tomorrow yesterday crowd feel beat move everyones jump shout alive chaotic sense endofasubhere tune give cinematic experience endofasubhere open hard band endofasubhere like play end old school movie endofasubhere remind little use play wwe game young type theyd play background werent match endofasubhere specific id chemical romance strong visuals someone drum continue vocal scream come match endofasubhere prematch fight tension build crowd cheer excitement endofasubhere punk flash light crowd moderate scale endofasubhere traditional sludge funeral doom type band much alley type especially recently small ish venue performing band popular year ago dark dingy room black attire long hair good mix female male endofasubhere large gathering crowd endofasubhere actor club bright light endofasubhere gig really recognise even ai perhaps dark light everyone trail black long hair leather candlelight endofasubhere could two long rival stand across ready battle century endofasubhere heavy band would perform front audience endofasubhere gig maybe performance band like tenacious lordi endofasubhere felt like introduction endofasubhere ever see disaster chipmunk first appear start sing remind band quite scary also appeal endofasubhere sweaty people bang head mosh pit drug endofasubhere people mosh pit heavy full scary look heavily tattoo pierced punk rocker endofasubhere attend definitely hear similar try could endofasubhere like endofasubhere like festival specifically people whos entire personality like best ever endofasubhere ,CONCERT-Met_LOW_09,CON_Met
29,concert ,Met,Met_LOW_14,dramatic endofasubhere chase someone twist small alleyway endofasubhere another like bos jrpg arcade time trial like light gun endofasubhere long haired fan listen sort felt similar fire flame endofasubhere thing could browser window youtube spotify play recommended track part mix endofasubhere relate moment joy dancing celebrate friend family endofasubhere attend lot show concert tune bring lot endofasubhere something like party since unpredictable progression guitar lovely listen endofasubhere envision roll musical performer take stage endofasubhere watch endofasubhere love great play would something would choose go semi style deep right amount action pack lot people sit row band play stand big stage lot light endofasubhere see star guitar also black hat tattoo endofasubhere play tv station news highlight present endofasubhere partner feel moment play endofasubhere roll band perform stage crowd full energy jump endofasubhere stage light flash strobing crowd get really small part crowd near front mosh whilst dot throughout crowd headbanging endofasubhere venue green strobe light flame shoot mosh pit endofasubhere someone foot chase run amongst street house go someone else high intensity quick foot chase endofasubhere thing come mind watch character guitar hero play character wear hat long black hair wear thick platform boot rip jean endofasubhere band event endofasubhere remind anime background character fight battle playing background also japanese band someone strum guitar enthusiastically endofasubhere say expect classical cool synth type band like remind blutengle depeche mode endofasubhere band stage jam instrumental part show guitar piano endofasubhere show strange thing character mission endofasubhere packed lot energy crowd people jump around sing along let loose whole place feel alive bright light everyone feeding band energy endofasubhere symphony indoor venue remind like final fantasy endofasubhere someone play keytar close keyboard endofasubhere friend lot fun endofasubhere listen felt excitement bit mood rush want get endofasubhere ,CONCERT-Met_LOW_14,CON_Met
30,concert ,Met,Met_MED_19,watch montage like action comedy one could actively like endofasubhere heavy gig festival endofasubhere hear sister kid listen like bang head pretend play air guitar hair would get crazy always much fun guitar battle endofasubhere dethklok thunderhorse great endofasubhere remind kid get bull finally get revenge guy mess endofasubhere discomfort really like iron maiden acdc come head colour red orange angry endofasubhere perform live stage endofasubhere action movie antagonist defeat parade people endofasubhere remind bit listen sweet child mine solo youtube bit similar endofasubhere play racing car fast sport car endofasubhere tony hawk downhill wii soundtrack like endofasubhere initially dad lead guitarist use practice room harmonising guitar part come black veil bride emo core belfast really cool alternative shop dark sell band shirt endofasubhere band playing endofasubhere band play hard stage crowd people hand raise air endofasubhere feels right home middle ongoing audience enrapture zone action energy keep go keep build pull along lead listener anticipate whats come next endofasubhere black veil bride dragonforce type guitar solo see german festival ring wacken endofasubhere live concert also go onto youtube see live performance band havent ben able see person like jimi hendrix etc endofasubhere watch wrestling feel emotional main wrestler entrance endofasubhere old star fox play tough climatic mission likely sort bos fight another hard sequence would serve hype moment memorable part ex endofasubhere motorbike come mind endofasubhere felt would fall genre like power symphonic thrash remind band call skiltron however conjure many visuals mind endofasubhere concert attend similar genre come mind endofasubhere like yungblud uplifting energetic endofasubhere  endofasubhere also like opening anime endofasubhere call stranger thing try kill monster endofasubhere could easily punk band maybe like fall boy instrumental section band somewhat close edge stage fan equally press edge stage band really play completely lose endofasubhere crowd great time form mosh pit front stage lead guitarist band solo endofasubhere first thought like american anime style cartoon bakugan shift guitar hero clear like someone hit note perfectly endofasubhere person work would listen use gym machine lift heavy weight caffeine endofasubhere ,CONCERT-Met_MED_19,CON_Met
